{
  "schemaVersion": "1.0",
  "description": "Governed site columns for the DMS, published from the Content Type Hub. PRD F-001. Internal names are stable contracts: they are referenced by views, flows, search mappings, reports and provisioning scripts and MUST NOT be renamed after first deployment.",
  "fieldGroup": "DMS Controlled Metadata",
  "namingRule": "Internal names are prefixed 'Dms' and are created explicitly so SharePoint does not derive an encoded name from the display name.",
  "indexingBudget": {
    "note": "SharePoint Online enforces a per-list indexed-column limit. PRD NFR-004 requires that no operational view depends on an unindexed high-cardinality query.",
    "maxIndexedColumnsPerList": 20
  },
  "columns": [
    {
      "internalName": "DmsDocumentId", "displayName": "Document ID", "type": "Text", "maxLength": 64,
      "required": true, "indexed": true, "enforceUniqueValues": false,
      "searchManagedProperty": "DmsDocumentIdOWSTEXT", "searchable": true, "queryable": true, "retrievable": true,
      "dataOwner": "Document Control", "sensitivity": "Internal",
      "validation": { "rule": "Matches the approved namespace pattern and is unique among non-Obsolete revisions of different documents.", "pattern": "REQUIRES_STAKEHOLDER_DECISION_OQ-11", "provisionalPattern": "^[A-Z]{2,5}-[A-Z]{2,4}-[0-9]{3,5}$" },
      "lifecycleMutability": { "editableInStates": [], "setBy": "SystemAutomation", "note": "Assigned at triage (T-01) and immutable thereafter. Rename and move must not change it. PRD F-002." },
      "requirements": ["F-002", "DATA-001"]
    },
    {
      "internalName": "DmsDocumentType", "displayName": "Document Type", "type": "Choice", "fillInChoice": false,
      "choices": ["Policy", "SOP", "Work Instruction", "Standard", "Controlled Form or Template", "Business Operations Document", "External Document"],
      "required": true, "indexed": true,
      "searchManagedProperty": "DmsDocumentTypeOWSCHCS", "searchable": true, "queryable": true, "refinable": true,
      "dataOwner": "Document Control", "sensitivity": "Internal",
      "validation": { "rule": "Must match the content type in use. Provisioning validates that the value set is consistent with config/content-types.json." },
      "lifecycleMutability": { "editableInStates": ["Triaged", "Authoring"], "setBy": "DocumentController", "note": "Changing type after authoring requires a new change request because routing and retention depend on it." },
      "requirements": ["F-001", "F-003", "DATA-001"]
    },
    {
      "internalName": "DmsBusinessFunction", "displayName": "Business Function", "type": "TaxonomyFieldType",
      "termSet": "Business Function", "allowMultipleValues": false,
      "required": true, "indexed": true, "refinable": true, "searchable": true, "queryable": true,
      "dataOwner": "Document Control", "sensitivity": "Internal",
      "validation": { "rule": "Must be an active term. Deprecated terms remain resolvable for history. PRD section 17.3." },
      "lifecycleMutability": { "editableInStates": ["Triaged", "Authoring", "Rework"], "setBy": "Author" },
      "requirements": ["F-001", "F-026", "DATA-001"]
    },
    {
      "internalName": "DmsBusinessProcess", "displayName": "Business Process", "type": "TaxonomyFieldType",
      "termSet": "Business Process", "allowMultipleValues": false,
      "required": true, "indexed": true, "refinable": true, "searchable": true, "queryable": true,
      "dataOwner": "Document Control", "sensitivity": "Internal",
      "validation": { "rule": "Must be an active term within the selected Business Function branch where the taxonomy defines that relationship." },
      "lifecycleMutability": { "editableInStates": ["Triaged", "Authoring", "Rework"], "setBy": "Author" },
      "requirements": ["F-001", "F-026", "DATA-001"]
    },
    {
      "internalName": "DmsDocumentOwner", "displayName": "Document Owner", "type": "User", "allowMultipleValues": false, "selectionMode": "PeopleOnly",
      "required": true, "indexed": true, "searchable": true, "queryable": true,
      "dataOwner": "Document Control", "sensitivity": "Personal",
      "validation": { "rule": "Must resolve to an active Entra identity. Departure raises an ownerless-document exception. PRD MET-005." },
      "lifecycleMutability": { "editableInStates": ["Triaged", "Authoring", "Rework", "Effective"], "setBy": "DocumentController", "note": "Ownership transfer while Effective is permitted and audited; it does not alter the approved revision." },
      "requirements": ["F-015", "F-024", "DATA-001"]
    },
    { "internalName": "DmsAuthor", "displayName": "Author", "type": "UserMulti", "selectionMode": "PeopleOnly", "required": false, "indexed": false, "dataOwner": "Document Owner", "sensitivity": "Personal", "validation": { "rule": "Active Entra identities or approved groups." }, "lifecycleMutability": { "editableInStates": ["Triaged", "Authoring", "Rework"], "setBy": "DocumentController" }, "requirements": ["DATA-001"] },
    { "internalName": "DmsReviewer", "displayName": "Reviewer", "type": "UserMulti", "selectionMode": "PeopleAndGroups", "required": false, "indexed": false, "dataOwner": "Document Control", "sensitivity": "Personal", "validation": { "rule": "Resolved from routing rules at submission; a manual override is audited." }, "lifecycleMutability": { "editableInStates": ["Triaged", "Authoring", "Rework"], "setBy": "DocumentController" }, "requirements": ["F-009", "DATA-004"] },
    { "internalName": "DmsApprover", "displayName": "Approver", "type": "UserMulti", "selectionMode": "PeopleAndGroups", "required": false, "indexed": false, "dataOwner": "Document Control", "sensitivity": "Personal", "validation": { "rule": "Must not equal the sole Author for the same revision. Separation of duties, PRD SEC-003." }, "lifecycleMutability": { "editableInStates": ["Triaged", "Authoring", "Rework"], "setBy": "DocumentController" }, "requirements": ["F-009", "SEC-003", "DATA-004"] },
    {
      "internalName": "DmsLifecycleStatus", "displayName": "Lifecycle Status", "type": "Choice", "fillInChoice": false,
      "choices": ["Requested", "Triaged", "Authoring", "In Review", "Rework", "Approved Pending Effective", "Effective", "Superseded", "Withdrawn", "Obsolete"],
      "defaultValue": "Authoring",
      "required": true, "indexed": true, "refinable": true, "searchable": true, "queryable": true,
      "searchManagedProperty": "DmsLifecycleStatusOWSCHCS",
      "dataOwner": "Document Control", "sensitivity": "Internal",
      "validation": { "rule": "Only values declared in config/lifecycle-states.json. Direct user edits are blocked by permission design; changes flow through the transition engine. PRD F-005." },
      "lifecycleMutability": { "editableInStates": [], "setBy": "SystemAutomation", "note": "Never a free-text or user-editable field in reader or author views." },
      "requirements": ["F-005", "F-012", "F-013"]
    },
    { "internalName": "DmsBusinessRevision", "displayName": "Business Revision", "type": "Text", "maxLength": 16, "required": true, "indexed": false, "searchable": true, "queryable": true, "dataOwner": "Document Control", "sensitivity": "Internal", "validation": { "rule": "Business revision is distinct from the SharePoint version. Convention pending OQ-11.", "provisionalPattern": "^[0-9]{1,3}(\\.[0-9]{1,2})?$" }, "lifecycleMutability": { "editableInStates": [], "setBy": "SystemAutomation" }, "requirements": ["F-002", "DATA-002"] },
    { "internalName": "DmsSharePointVersionRef", "displayName": "SharePoint Version Reference", "type": "Text", "maxLength": 16, "required": false, "indexed": false, "dataOwner": "Platform", "sensitivity": "Internal", "validation": { "rule": "The platform version label of the activated major version, e.g. 3.0. Recorded for evidence reconciliation." }, "lifecycleMutability": { "editableInStates": [], "setBy": "SystemAutomation" }, "requirements": ["F-010", "NFR-011", "DATA-002"] },
    { "internalName": "DmsEffectiveDate", "displayName": "Effective Date", "type": "DateTime", "displayFormat": "DateOnly", "required": false, "indexed": true, "searchable": true, "queryable": true, "sortable": true, "dataOwner": "Document Control", "sensitivity": "Internal", "validation": { "rule": "Required before final approval. Stored in UTC; displayed in the tenant default time zone. PRD section 17.3." }, "lifecycleMutability": { "editableInStates": ["Authoring", "Rework", "InReview"], "setBy": "DocumentController" }, "requirements": ["F-012", "DATA-002"] },
    { "internalName": "DmsNextReviewDate", "displayName": "Next Review Date", "type": "DateTime", "displayFormat": "DateOnly", "required": false, "indexed": true, "queryable": true, "sortable": true, "dataOwner": "Document Owner", "sensitivity": "Internal", "validation": { "rule": "Calculated from DmsReviewFrequencyMonths and the effective date. May only move forward when an attributable review decision exists. PRD F-015." }, "lifecycleMutability": { "editableInStates": [], "setBy": "SystemAutomation" }, "requirements": ["F-015", "MET-004"] },
    { "internalName": "DmsReviewFrequencyMonths", "displayName": "Review Frequency (months)", "type": "Number", "decimals": 0, "minimum": 1, "maximum": 120, "required": true, "indexed": false, "dataOwner": "Document Owner", "sensitivity": "Internal", "validation": { "rule": "Must match an active entry in the Review Frequencies list." }, "lifecycleMutability": { "editableInStates": ["Triaged", "Authoring", "Rework", "Effective"], "setBy": "DocumentOwner" }, "requirements": ["F-015"] },